{
  "apiVersion": "acorn.dev/ui-document/v2",
  "documentId": "01935c8b-4db3-7c80-981e-0bb9f809892d",
  "viewSession": "acorn://01935c7a-20d2-7a34-baf4-72df9230e3b1/view-session/01935c8b-43f8-7d88-b8df-14b263cb8442",
  "revision": "1",
  "title": "Service health",
  "accessibilityLabel": "Service health monitor",
  "root": {
    "key": "root",
    "renderer": "acorn.stack/1",
    "props": {
      "gap": "medium"
    },
    "bindings": {},
    "actions": {},
    "children": [
      {
        "key": "status",
        "renderer": "acorn.status/1",
        "props": {
          "label": "Healthy",
          "tone": "positive"
        },
        "bindings": {
          "label": {
            "source": "health",
            "path": "/label"
          }
        },
        "actions": {
          "activate": {
            "action": "dev.acme.monitor.refresh.v1",
            "input": {},
            "confirmation": "none"
          }
        },
        "children": []
      }
    ]
  }
}
